{
  "schemaVersion": "1.0.0",
  "id": "16-tower",
  "displayName": "Kule",
  "englishName": "The Tower",
  "arcanaNumber": 16,
  "arcana": "major",
  "sourceLayer": {
    "themes": [
      "beklenmedik farkındalık",
      "mevcut temellerin sorgulanması",
      "katılaşmış varsayımların esnemesi",
      "yeniden değerlendirme için alan açılması"
    ],
    "meaning": "Kule, güvenilir veya değişmez kabul edilen bazı yapıların ve varsayımların yeniden değerlendirilmesine yol açabilecek bir farkındalık anını sembolize eder.",
    "centralTension": "Mevcut düzeni koruma isteği ile yeni bilgiler karşısında düşünce ve planları yeniden değerlendirme ihtiyacı arasındaki gerilim.",
    "doesNotMean": [
      "fiziksel kaza veya ölüm",
      "kaçınılmaz felaket",
      "cezalandırılma",
      "iş, ilişki, sağlık, hukuk veya finans sonucu hakkında kesin tahmin"
    ],
    "symbols": [
      {
        "id": "lightning",
        "label": "Yıldırım",
        "meaning": "Ani, dışarıdan gelen bir gerçeklik anı; önceden inşa edilmiş yapıyı test eden ani bir dokunuş.",
        "safeUse": "'Aniden fark edilen bir gerçek' olarak çerçevelemek.",
        "risk": "'Başınıza bir felaket gelecek' gibi literal afet kehaneti üretmek."
      },
      {
        "id": "tower",
        "label": "Kule",
        "meaning": "Sağlam sanılan ama temeli sorgulanabilir bir yapı.",
        "safeUse": "'Hangi inanç/alışkanlık artık sizi eskisi kadar taşımıyor olabilir?' sorusu.",
        "risk": "'İlişkiniz/işiniz kesin bitecek' demek."
      },
      {
        "id": "flames",
        "label": "Alevler/ışık patlaması",
        "meaning": "Karanlıkta aniden açığa çıkan bir farkındalık anı.",
        "safeUse": "'Aniden netleşen bir şey' olarak çerçevelemek.",
        "risk": "Mistik/kader dili ('evren size mesaj gönderiyor') kullanmak."
      },
      {
        "id": "falling-figures",
        "label": "Düşen figürler",
        "meaning": "Ani bir sarsıntının yarattığı denge kaybı hissi.",
        "safeUse": "'Kontrolü bırakmanın nasıl hissettirdiği' sorusu.",
        "risk": "Kullanıcının kişisel olarak 'düşeceğini/başarısız olacağını' ima etmek."
      }
    ]
  },
  "reflectionLayer": {
    "positions": {
      "past": {
        "focus": "Önceki bir kırılma, değişiklik veya farkındalık deneyiminin bugünkü bakış açısına olası etkisi.",
        "safeInterpretations": [
          "Geçmişte yaşanan ani bir farkındalık anı, o dönem güvenilir sanılan bir yapının aslında sorgulanabilir olduğunu gösterebilir.",
          "Bu kart, geçmişteki bir kırılmanın bugünkü bakış açınızı şekillendirmiş olabileceğini yansıtabilir."
        ],
        "reflectionQuestions": [
          "O dönem hangi yapının sandığınızdan daha kırılgan olduğunu fark ettiniz mi?",
          "O deneyimden bugüne taşıdığınız bir öğrenme var mı?"
        ],
        "prohibitedInferences": [
          "Kullanıcının o dönem travma yaşadığı varsayılamaz.",
          "Olayın sorumlusunun kim olduğu hakkında kesin çıkarım yapılamaz."
        ]
      },
      "present": {
        "focus": "Mevcut düzende sürdürülebilirliği veya işlevi yeniden değerlendirilebilecek unsurlar.",
        "safeInterpretations": [
          "Şu anda, mevcut düzende sürdürülebilirliği sorgulanabilecek bir unsur görünür olabilir.",
          "Bu kart, daha önce fark edilmeyen bir gerilimin şimdi daha görünür hale geldiğini yansıtabilir."
        ],
        "reflectionQuestions": [
          "Şu anda hangi yapı ya da anlayış sizi eskisi kadar taşımıyor olabilir?",
          "Bu durumda gerçekten neyin hâlâ işlevsel kaldığını fark ediyor musunuz?"
        ],
        "prohibitedInferences": [
          "Kullanıcının şu anda bir kriz yaşadığı varsayılamaz.",
          "Kullanıcının çaresiz veya bunalmış olduğu varsayılamaz."
        ]
      },
      "direction": {
        "focus": "Daha esnek, doğrulanabilir veya sürdürülebilir bir yaklaşımın hangi alanlarda değerlendirilebileceği.",
        "safeInterpretations": [
          "Bu kart, daha esnek ya da doğrulanabilir bir yaklaşımın hangi alanlarda değerlendirilebileceğini düşündürebilir.",
          "Yön, yeni bilgiler karşısında bir planı yeniden gözden geçirmenin bir seçenek olabileceğine işaret edebilir."
        ],
        "reflectionQuestions": [
          "Şu an sahip olduğunuz seçeneklerden hangisini daha yakından incelemek isterdiniz?",
          "Bu farkındalık sizi hangi soruyu sormaya çağırıyor?"
        ],
        "prohibitedInferences": [
          "Kullanıcının hangi kararı vereceği kesin olarak varsayılamaz.",
          "Belirli bir ilişkiyi bitirip bitirmeyeceği ya da işi bırakıp bırakmayacağı varsayılamaz."
        ]
      }
    },
    "contexts": {
      "career": {
        "focus": "Mevcut çalışma düzenindeki varsayımların yeniden değerlendirilmesi.",
        "followUpQuestion": "Mevcut çalışma düzeninizde hangi varsayımları yeniden değerlendirmek size daha fazla netlik sağlayabilir?",
        "avoid": "Belirli bir iş kaybı ya da terfi sonucu hakkında kesin tahmin üretmek."
      },
      "relationship": {
        "focus": "İlişkideki beklenti ve iletişim biçimlerinin yeniden değerlendirilmesi.",
        "followUpQuestion": "Bu ilişkide hangi beklentilerin veya iletişim biçimlerinin daha açık değerlendirilmesi size yardımcı olabilir?",
        "avoid": "İlişkinin bitip bitmeyeceği ya da bir ihanet olup olmadığı hakkında kesin iddia üretmek."
      },
      "decision": {
        "focus": "Bir kararın dayandığı varsayımların gözden geçirilmesi.",
        "followUpQuestion": "Bu kararı hangi varsayım üzerine kuruyorsunuz?",
        "avoid": "Hangi seçimin 'doğru' olduğunu söylemek."
      },
      "family": {
        "focus": "Aile içindeki beklenti, rol veya iletişim biçimlerinin yeniden değerlendirilmesi.",
        "followUpQuestion": "Aile içindeki hangi beklenti, rol veya iletişim biçimini daha açık değerlendirmek istersiniz?",
        "avoid": "Belirli bir aile üyesi hakkında suçlama ya da teşhis üretmek."
      },
      "boundaries": {
        "focus": "Bir sınırın daha açık ifade edilmesi ihtiyacı.",
        "followUpQuestion": "Bu ilişkide veya ortamda hangi sınırlarınızın daha açık ifade edilmesi size yardımcı olabilir?",
        "avoid": "Belirli bir kişiden uzaklaşılması gerektiğini söylemek."
      },
      "self-awareness": {
        "focus": "Kendinizle ilgili bir anlatının yeniden değerlendirilmesi.",
        "followUpQuestion": "Kendinizle ilgili hangi anlatı veya beklentiyi yeniden değerlendirmek istersiniz?",
        "avoid": "Kişilik teşhisi ya da sabit bir etiket kullanmak."
      },
      "uncertainty": {
        "focus": "Belirsizlik içinde kontrol alanında olanlarla açık kalan unsurların ayırt edilmesi.",
        "followUpQuestion": "Bu durumda hangi unsurlar kontrolünüzde, hangileri henüz açık görünüyor?",
        "avoid": "Belirsizliğin ne zaman veya nasıl biteceğini söylemek."
      },
      "change": {
        "focus": "Gündemdeki bir değişim ihtimalinin seçenekleri yeniden değerlendirmeye açması.",
        "followUpQuestion": "Gündeminizdeki değişim ihtimali, hangi seçenekleri yeniden değerlendirmenize alan açıyor?",
        "avoid": "Değişimin kaçınılmaz olduğunu ya da felakete yol açacağını söylemek."
      }
    },
    "userSignalLenses": {
      "financial-security-concern": {
        "signalRef": "financial-security-concern",
        "focus": "Mevcut mali/yapısal güvencenin sağlamlığının değerlendirilmesi.",
        "safeInterpretation": "Bu kart, güvence hissinin nereye dayandığını sorgulamaya davet edebilir.",
        "reflectionQuestion": "Güvenliğinizi neye dayandırıyorsunuz?",
        "prohibitedAssumptions": [
          "Kullanıcının gerçekten mali kayıp yaşayacağı varsayılamaz.",
          "Belirli bir yatırım/kararın sonucu hakkında tahmin üretilemez."
        ]
      },
      "decision-uncertainty": {
        "signalRef": "decision-uncertainty",
        "focus": "Kararın 'mükemmel' olmasından çok, sağlam bir temele dayanmasının önemi.",
        "safeInterpretation": "Kule, kusursuz değil, sağlam bir temel aramanın önemine işaret edebilir.",
        "reflectionQuestion": "Bu kararı sağlam kılan nedir sizce?",
        "prohibitedAssumptions": [
          "Kullanıcının yakında yanlış bir karar vereceği varsayılamaz.",
          "Hangi seçimin doğru olduğu söylenemez."
        ]
      },
      "control-scope-clarification": {
        "signalRef": "control-scope-clarification",
        "focus": "Kontrol alanında olanlarla olmayanların ayırt edilmesi.",
        "safeInterpretation": "Bu kart, her şeyi kontrol etmenin mümkün olmadığı anları yansıtabilir.",
        "reflectionQuestion": "Bu durumda kontrolünüzde olanlarla olmayanları nasıl ayırıyorsunuz?",
        "prohibitedAssumptions": [
          "Kullanıcının 'kontrolcü' bir kişilik olduğu varsayılamaz.",
          "Kontrol kaybının olumsuz bir sonuca yol açacağı iddia edilemez."
        ]
      },
      "change-hesitation": {
        "signalRef": "change-hesitation",
        "focus": "Değişimin yıkıcı değil, açığa çıkarıcı bir yönü olabileceği.",
        "safeInterpretation": "Kule, korkulan değişimin bazen önceden görünmeyen bir şeyi görünür kıldığını düşündürebilir.",
        "reflectionQuestion": "Bu değişimi yalnızca kayıp olarak değerlendirmeseydiniz, hangi seçenekleri daha açık inceleyebilirdiniz?",
        "prohibitedAssumptions": [
          "Kullanıcının değişime 'hazır olmadığı' varsayılamaz.",
          "Değişimin olumsuz sonuçlanacağı iddia edilemez."
        ]
      },
      "responsibility-sustainability": {
        "signalRef": "responsibility-sustainability",
        "focus": "Mevcut sorumlulukların sürdürülebilirliğinin ve kapasiteyle uyumunun değerlendirilmesi.",
        "safeInterpretation": "Bu kart, mevcut sorumlulukların sürdürülebilirliğini ve kapasitenizle uyumunu değerlendirmek için bir mercek sunabilir.",